<?xml version="1.0" encoding="UTF-8"?>
<?xml-stylesheet type="text/css" href="style2.css"?>
<!DOCTYPE products [
    <!ELEMENT products (product+)>
    <!ELEMENT product (name, price, description)>
    <!ELEMENT name (#PCDATA)>
    <!ELEMENT price (#PCDATA)>
    <!ELEMENT description (#PCDATA)>
]>
<products>
    <product>
        <name>Wooden Vase</name>
        <price>$25</price>
        <description>Elegant wooden vase with floral carvings.</description>
    </product>
    <product>
        <name>Ceramic Pot</name>
        <price>$15</price>
        <description>Beautiful hand-painted ceramic pot.</description>
    </product>
    <product>
        <name>Glass Jar</name>
        <price>$10</price>
        <description>Decorative glass jar for home decor.</description>
    </product>
</products>
